7g7M96UGiA7OR79H86gV4m,3LN41NUdHkyNqQhi9gExMm,U and Dat (feat. T. Pain & Kandi Girl),Hypnotized (feat. Akon),0.07
7g7M96UGiA7OR79H86gV4m,43VXG87ajppI8mO1Mxo8vu,U and Dat (feat. T. Pain & Kandi Girl),FEFE (feat. Nicki Minaj & Murda Beatz),0.14
7g7M96UGiA7OR79H86gV4m,4Oun2ylbjFKMPTiaSbbCih,U and Dat (feat. T. Pain & Kandi Girl),WAP (feat. Megan Thee Stallion),0.06
3LN41NUdHkyNqQhi9gExMm,43VXG87ajppI8mO1Mxo8vu,Hypnotized (feat. Akon),FEFE (feat. Nicki Minaj & Murda Beatz),0.1
3LN41NUdHkyNqQhi9gExMm,4Oun2ylbjFKMPTiaSbbCih,Hypnotized (feat. Akon),WAP (feat. Megan Thee Stallion),0.12
0x3TibRgnSqzkcwrqBd4iX,2XHzzp1j4IfTNp1FTn7YFg,Down On Me,Love Me,0.23
43VXG87ajppI8mO1Mxo8vu,4Oun2ylbjFKMPTiaSbbCih,FEFE (feat. Nicki Minaj & Murda Beatz),WAP (feat. Megan Thee Stallion),0.08
