7g7M96UGiA7OR79H86gV4m,4q6dqyGM25sKFU8nYAGRe4,U and Dat (feat. T. Pain & Kandi Girl),Show Me (feat. Chris Brown),0.12
7g7M96UGiA7OR79H86gV4m,0fgZUSa7D7aVvv3GfO0A1n,U and Dat (feat. T. Pain & Kandi Girl),Post to Be (feat. Chris Brown & Jhene Aiko),0.17
7g7M96UGiA7OR79H86gV4m,0FZ4Dmg8jJJAPJnvBIzD9z,U and Dat (feat. T. Pain & Kandi Girl),ZEZE (feat. Travis Scott & Offset),0.19
4q6dqyGM25sKFU8nYAGRe4,0fgZUSa7D7aVvv3GfO0A1n,Show Me (feat. Chris Brown),Post to Be (feat. Chris Brown & Jhene Aiko),0.23
4q6dqyGM25sKFU8nYAGRe4,0FZ4Dmg8jJJAPJnvBIzD9z,Show Me (feat. Chris Brown),ZEZE (feat. Travis Scott & Offset),0.1
0fgZUSa7D7aVvv3GfO0A1n,0FZ4Dmg8jJJAPJnvBIzD9z,Post to Be (feat. Chris Brown & Jhene Aiko),ZEZE (feat. Travis Scott & Offset),0.12
